"File","Coder","Coded","Id","Codename","Coded_Memo","Category"
"Grupo 4 - Classe Média - Pretos - 10-10-2014.docx","José Victor","M: Qual é a diferença entre ser rico e ter riqueza? Vamos, XXX.  P2: Eu ainda acredito que ter a riqueza é deter o poder.   M: Ter a riqueza é deter o...  P2: É deter o poder, é ser livre. Porque tem pessoas que são ricas e não são livres. A riqueza ela detém o poder, o controle, até todas as gerações, a pessoa pode ter um milhão de gerações e ela vai continuar ali detendo aquele poder. Entendeu? Para mim isso é muito perceptível. E a diferença é essa de ser rico, porque muitas das vezes o rico, ele... Aí fico eu pensando, estruturando na pesquisa do IBGE, aquela tabela básica, ele tem problemas financeiros sim, porque ele trabalha para pagar a conta, o rico ele trabalha hoje em dia… //  P7: Para fazer a manutenção do dinheiro  P2: // Exatamente, para poder fazer a manutenção... Quem tem riqueza não precisa realmente se preocupar com isso.   P1: Só que manter ou multiplicar a riqueza dele.   P2: Ele respirou, a riqueza dele se multiplica. Então tem essa questão da detenção do poder porque... Vai sendo a descendência, meio de uma ascendência e uma descendência e a riqueza vai se manter junto com o poder, com os privilégios, com os lugares abertos. Vão colocar pessoas como eu, agora eu falo por mim, que tem sempre essa autoafirmação de que precisa se estudar, precisa se estudar, precisa se estudar, mas hoje eu já tenho uma consciência que eu não serei uma pessoa rica. Então eu estudo muito para poder dividir esse saber que eu gosto muito, eu gosto muito de lecionar e dividir esse saber, mas eu sei que eu não vou ser uma pessoa rica, eu não vou deter riqueza, não vou deter poder. Mas eu gosto de estudar muito para poder me sentir um pouco mais livre. Eu acredito que quem tem essa riqueza é totalmente livre, pode tudo.","ctid:1886","26 Desmerecimento","","2 Fontes da Riqueza"
"Grupo 4 - Classe Média - Pretos - 10-10-2014.docx","José Victor","P7: É a diferença... Eu acho que eu vejo muito como a diferença do ser e o estar. Por exemplo, o Neymar, ele é rico, ele detém riqueza, diferente de outras pessoas que ficaram ricas e tem que fazer a manutenção daquilo. O Neymar pode parar em qualquer momento, ele continuará bilionário, milionário, ele vai continuar a viver... É a diferença do ser e do estar, ele é, o filho dele é, o filho do filho dele vai ser. É a assim, é isso, essa é a diferença do ser e do estar, ele é. Outras pessoas que estão tendo acesso agora...  P3: Diversas famílias, que todo mundo deve ter um exemplo, são famílias que não vão deixar de deter riqueza nunca.   P7: Que vão viver dos royalties, né?  P2: Isso, exatamente.  P3: E diversos segmentos, petróleo, comunicação, indústria farmacêutica, são famílias...  P2: Que há manutenção.  P3: São famílias que vai sair um e entrar outro...  P1: São mais de 500 rádios no Nordeste. Você acha que...  P3: Só muda a posição política também...  P2: Isso.  P3: Tem várias famílias, sai um e entra outro, sai um... Se alguém quiser vir aqui não consegue...  PN: Família Garotinho.  P6: O famoso nepotismo.  P3: É escada rolante, fica ali sempre os mesmos...  P7: E só conseguem ser ricos em detrimento de uma galera que é pobre.  P1: Claro.  P7: Para que essa galera, para que o Neymar seja esse cara milionário, tem uma galera que ele sonega imposto, tem uma galera que ele desviava da mansão lá da… da região Costa Verde... //  P1: Não é só isso. Tem muito pobre que é levado a consumir aquilo que o Neymar vende...  P7: // Sim. Aquelas bets da vida, que....","ctid:1893","26 Desmerecimento","","2 Fontes da Riqueza"
"Grupo 4 - Classe Média - Pretos - 10-10-2014.docx","José Victor","P5: Essa aí eu precisaria elaborar um pouquinho melhor, mas eu acho que a riqueza seria a forma como você aplicaria a sua renda. A forma como você colocaria o dinheiro para trabalhar para você.  PN: Perfeito.  P1: E com uma diferença muito grande. O pobre vende sua força de trabalho para obter renda. O rico só precisa fazer sua riqueza trabalhar para ele para gerar a renda dele.  P2: Perfeito, XXX.","ctid:1903","26 Desmerecimento","","2 Fontes da Riqueza"
"Grupo 4 - Classe Média - Pretos - 10-10-2014.docx","José Victor","P7: Trabalho a gente sabe que não é, né? Eu sei, minha avó sabia, minha bisavó, todos nós sabíamos...  P1: Vamos fazer uma inversão, então, com base no que ela disse. Ela chegou à conclusão de que ela não poderá ser rica. Qual é a única forma que um pobre aqui nesse país tem de ficar rico, de ser rico, ou ele vai dar uma grande sorte de ganhar a loteria, ou ele vai fazer algo que é considerado ilícito e que será considerado ilícito até o dia que o branco deter todo o meio de produção daquilo ali. Você espera até toda a produção de maconha do planeta estar na mão de uma multinacional e ela é legalizada no dia seguinte.  P7: Até porque o traficante é só aquela pontinha do iceberg.  P1: Claro. Exatamente.","ctid:1907","26 Desmerecimento","","2 Fontes da Riqueza"
"Grupo 4 - Classe Média - Pretos - 10-10-2014.docx","José Victor","P1: Cara, olha só, depois de 20 anos eu fui com a minha esposa para a gente comprar uma... 20 anos juntando dinheiro para a gente comprar um apartamento no condomínio que a gente sonhou em ter. Bom, a gente foi realmente comprar apartamento num condomínio onde só aquele 1% da população vai morar. Aí o corretor chega e fala: “Tá uma maravilha, só hoje eu vendi 10 para uma única a pessoa”. Meu amigo, eu duvido que alguém que saia da pobreza, meramente trabalhando, consiga chegar num condomínio e comprar 10 unidades de imóvel que custa 2.350.000 reais só trabalhando. Ou o cara já era rico ou hoje ele tá envolvido com alguma atividade ilícita. O mero trabalho não vai permitir que ele faça isso.  P2: Exatamente  P6: Para CLT é mais difícil. [risos]  P2: É, porque na realidade...  P1: Aí você tem aí... Sonegação de imposto, tem uma série de coisas que você pode fazer. A corrupção...  P7: Até na própria compra dele vai ter uma coisinha...","ctid:1909","26 Desmerecimento","","2 Fontes da Riqueza"
"Grupo 4 - Classe Média - Pretos - 10-10-2014.docx","José Victor","P1: Eu conheço pessoas brancas, eu acho que talvez por conviver comigo há muito tempo, por eu não ser retinto, elas devem achar que eu me enxergo como branco, eu não sei. Porque as coisas que eu escuto às vezes... Eu conheço uma que, inclusive, é uma pessoa absurdamente privilegiada, ela nasceu bem, os filhos herdaram isso, nunca precisaram se esforçar para nada. E é uma pessoa que não tem o menor pudor em abrir a boca e falar: “Pronto, agora é tudo para os negros”. Eu escuto e é do meu trabalho. O filho dela nunca precisa de nada, ela está nervosa porque alguma coisa está sendo feita para tentar minorar as desigualdades. Seja uma cota, seja o que for. Eles se doem, cara, eles se doem. Eu olhei para ela bem calmo nesse dia: “Olha só, para para pensar. Você já parou para imaginar que os seus filhos estudaram na escola alemã a vida inteira, de lá estão na PUC agora, nunca andaram um dia da vida deles sequer a pé, a não ser quando eles quiseram, foram tratados pelos melhores médicos e possuíam, desde sempre, a melhor alimentação. Você realmente acha que eles estão em condição de igualdade com o garoto lá no alto da comunidade?”. Ela diz, “Não, mas é que...” Então, pronto, você sabe que não tem... Não há algo o que dizer com relação a isso, você está se doendo, eu nem sei por quê. Você precisa, eu falei para ela: “Você tem que tentar entender por que você está se doendo por isso, que nem eu mesmo consegui entender por que você consegue se doer por uma cota”. Mas eu escuto isso. Não sei se você passa por essa experiência, mas no meu trabalho eu escuto esses absurdos.  ","ctid:1945","26 Desmerecimento","","2 Fontes da Riqueza"
"Grupo 4 - Classe Média - Pretos - 10-10-2014.docx","José Victor","P2: Então eu acho que eu penso em controle, até porque a riqueza mesmo, o dinheiro, o dinheiro de fato, é um controle de poucos, entendeu? Então por isso eu não me vejo... Eu tenho essas idealizações, mas eu não consigo pensar em que geração eu vou ter esse dinheiro. E eu também acredito, com o meu pé no chão, que eu não vou ter esse dinheiro, porque eu acredito que esse dinheiro é centralizado para poucos. Eu acredito que a minha geração não vai ter acesso a ele, por mais que a gente trabalhe, trabalhe, trabalhe, porque isso, na minha percepção, é algo estrutural da sociedade que a gente está inserido. Então, essa sociedade, ela é rica, de muitas riquezas, mas centralizada em mãos de poucas pessoas. ","ctid:1868","31 Por que / causa","","3 Desigualdades"
"Grupo 4 - Classe Média - Pretos - 10-10-2014.docx","José Victor","P7: Mas aí a gente teria que fazer outra pergunta. Por que quem trabalha, a maioria das pessoas que trabalha não consegue ficar rica, se a riqueza vem do trabalho? A maioria de nós trabalha para caramba, morre trabalhando, e não consegue ficar rico.  P2: Porque na realidade o trabalho... Eu até tentei pensar a resposta do XXX. Assim, o trabalho que traz essa riqueza não é o trabalho da pessoa que vende a sua força de trabalho. É o trabalho, o “trabalho”, entre aspas, muitas, muitas aspas, da pessoa que detém os meios de produção. Então a detenção do meio de produção... Aí eu volto e concordo lá com a galera do XXX, que o patrão realmente ele é o vilão, entendeu? Ele é o vilão, porque ele faz o que? A pessoa tá ali trabalhando, trabalhando e ele vai reter a maior parte, a manutenção da riqueza dele... //      P5: Explorando...  P2: // Exatamente.  P1: E aí a gente vai ter que trocar o termo, porque isso não é trabalho. Isso é empreender. Você alocou capital no empreendimento...  P2: Isso.  P1: Empregou pessoas, se valeu da força de trabalho delas, ampliou seu capital e nesse mecanismo você enriquece. Agora, trabalho... //  P2: Isso.  P1: // Trabalhando para alguém você não vai ficar rico... //  P2: E voltamos para o estrutural...  P1: // A não ser que você tenha uma habilidade específica que faça com que seu patrão ganhe muito mais dinheiro do que você, e aí ele vai te pagar bem. Aí você tem o cara que é um puta trader, no setor financeiro, ou um cara que é um tremendo analista que está prestando serviço dele por escritório de advocacia e por aí vai indo. São pessoas que prestam trabalho intelectual, mas elas estão num ponto absurdamente fora da curva, elas têm uma habilidade específica em um nível que nenhum de nós tem. Senão a gente não estaria aqui, a gente estaria, sei lá, em algum lugar, gastando muita grana. [risos] ","ctid:1915","31 Por que / causa","","3 Desigualdades"
"Grupo 4 - Classe Média - Pretos - 10-10-2014.docx","José Victor","P1: Eu atendo a classe “AAA” há 20 anos. Eu dei sorte, recém-formado, de cair com um cara que atendia essa galera. Ele me levou junto e ali fiquei até hoje. A visão deles é assim olha. E eles acreditam nessas anedotas, como a meritocracia, eles não enxergam que pessoas capazes de deter esse patrimônio inteiro, capazes de ter uma ação real sobre o entorno...   P2: Exatamente. Mas não é que eles não enxerguem, XXX.   P1: Alguns não enxergam... Tem os FDPs, eu sei...  P6: Às vezes são nascidos e criados dessas formas, entendeu?  P2: Não vão querer enxergar e sair dos seus próprios privilégios, eles não vão querer... Não querem...  P7: E são pessoas que terceirizam responsabilidades.  P2: Exatamente.  P1: A responsabilidade é do governo.   P7: Do governo, é só do governo. “Mas meu imposto não pago direito, eu faço várias...”. A responsabilidade é do governo.  P1: É como ela falou, ele não vai aceitar o decréscimo de 10% do padrão de vida dele para que a maioria ganhe mais 50. ","ctid:1940","31 Por que / causa","","3 Desigualdades"
"Grupo 4 - Classe Média - Pretos - 10-10-2014.docx","José Victor","P2: Porque para mim é um problema não resolvido. A conta não bate. Vai ser um eterno problema. Eu não consigo ter... Não que eu seja uma pessoa negativa, tá gente? Mas eu não consigo ver dentro dessa estrutura, desde a colonização, desde essa questão da detenção do poder, do capital, não consigo pensar uma saída para que essa sociedade desigual passe a ser uma sociedade igual. Porque quem tem essa detenção dessa riqueza, finge e não vai abrir mão dela, não vai. E muitas das vezes, eu já tive a oportunidade de conhecer um produtor de cinema e ele se sentia um camarada militante, ajudava, blablabá, e uma semana conhecendo eu fui pontuando todas as frases racistas, todas as frases preconceituosas, enfim, perdi o amigo. Mas, assim, é desse jeito, porque se qualquer coisa que leve a eles refletirem sobre... // ","ctid:3569","31 Por que / causa","","3 Desigualdades"
"Grupo 4 - Classe Média - Pretos - 10-10-2014.docx","José Victor","P7: Você poder custear a saúde, né? Porque é muito caro, saúde é uma coisa muito cara, a gente só percebe isso quando a gente se vê com a ausência da saúde. Eu tenho... Minha mãe passou por problema de saúde mental recentemente, ela infartou, deve ter sido há duas semanas, e eu percebi isso, se eu não tivesse tantos contatos na saúde, se eu não fosse uma pessoa da saúde, o quão difícil seria? Se eu não tivesse acesso, se eu não peitasse médico... O quão difícil. E a gente só percebe isso quando a gente se vê na ausência de saúde, né? A gente vê o quanto o ter dinheiro, o quanto o acesso facilita. Facilita muito. ","ctid:1866","32 Desigualdade de acesso e/ou de oportunidades","","3 Desigualdades"
"Grupo 4 - Classe Média - Pretos - 10-10-2014.docx","José Victor","M: E aí não ser rico significa...   P5: Não ter acesso, não ter possibilidades de construir.   P6: Ter barreiras.   M: Oi?  P6: Ter barreiras.  M: Ter barreiras.   P2: Não ter perspectivas.   P1: Principalmente isso.   P2: Frustração, né? Porque na realidade a gente trabalha tanto e a gente fica frustrado porque a gente não alcança... //  PN: Exatamente ","ctid:1877","32 Desigualdade de acesso e/ou de oportunidades","","3 Desigualdades"
"Grupo 4 - Classe Média - Pretos - 10-10-2014.docx","José Victor","P1: Só quem realmente cresceu dentro de uma comunidade ou próximo a ela, ou ali no entorno, naquela realidade, vai entender isso que você está falando. A gente é de saúde. Sabe qual é a coisa que eu mais experienciei na minha vida? Talvez não agora, porque de uma certa forma, com a barba branca, a idade sempre dá para as pessoas uma percepção de experiência. Mas quando eu era mais novinho, eu percebi que quando eu chegava na casa de alguém para atender um paciente ou algum serviço de saúde, primeiro me tratavam de uma forma. Depois quando eu começava a falar, trabalhar, aí o tratamento era outro. O branco não passa por isso. Porque o negro eles vão sempre achar que a gente é menos preparado.   P6: O famoso preconceito  P1: Pré-conceito, não é... Não chega a ser racismo. Mas é um preconceito.   M: Mas vocês acham isso?  P1: Total  P2: Sim  M: Vocês concordam com isso?  P1: A gente passa por isso. Eu não sei como é nas outras áreas, mas na saúde eu experienciei isso muito. Chegava, começava a falar, do caso clínico do meu paciente, tratar, propor. Aí as pessoas… “Humn”. E era sempre aquele mesmo olhar. “Ah, ele é competente”.   P6: Mas isso são em todas as áreas. Entrevista de emprego...   P1: Não. Sim, sim, sim. Só a dinâmica, que eu não sei como é nas outras.   P7: É, por exemplo, a gente, como não sei se vocês também já experienciaram isso, quando a gente fala alguma coisa, quando a gente fala sobre experiência técnica, a gente sempre tem que trazer referência, tem que trazer referência na ponta da língua... //  P1: Uhum.  P7: // Porque senão não passa credibilidade. E as pessoas acham que todo conhecimento é de... “Ah, isso é conhecimento empírico”. Como se conhecimento empírico não importasse.  P1: Exatamente.  P7: Como se só importasse aquele conhecimento branco, que é acadêmico... Quantas pessoas são desvalidadas porque não acessaram a universidade. E são pessoas muito fodas, desculpa a palavra, são pessoas que vivem... São pessoas incríveis, incríveis, que não passaram pela universidade. Também não faz diferença nenhuma para elas, que não passaram pela universidade e tem tanto conhecimento quanto quem é mestre, quem é doutor, sabe? E às vezes, quando eu tô no meio de pessoas pretas, o que menos importa são os meus títulos. O que menos importa são os meus títulos. Os meus títulos são importantes para mim, para meus acessos, para minha família porque a gente acaba sendo às vezes os únicos, às vezes os primeiros na nossa família. E quando a gente está no meio de gente branca que quer pagar de que sabe tudo... Aí sim nossos títulos são importantes. Eu trabalho com médicos, e eles não são doutores...  P1: O doutor é você. [risos]","ctid:1882","32 Desigualdade de acesso e/ou de oportunidades","","3 Desigualdades"
"Grupo 4 - Classe Média - Pretos - 10-10-2014.docx","José Victor","P7: // No meu dia a dia do trabalho... Eu trabalho numa área que está diretamente ligada ao empobrecimento da população. E se os casos aumentam é porque a população está mais empobrecida, está tendo menos conhecimento. E é muita loucura também, porque você ainda mora em Nilópolis, as pessoas acham que quem mora na Baixada é todo mundo pobre. As pessoas quando eu falo acham: “Ai você ainda mora na Baixada?” Eu falo: “Ah, gente, mas por quê?”. E as pessoas acham que se a gente mora na Baixada... “Por que tu mora na Baixada?” E existe muito preconceito. Eu lembro, quando eu tinha uns 16 anos eu fui participar de uma entrevista de emprego para trabalhar numa grande marca de fast food. Aí a mulher falou assim, aqui no centro: “Quem é que é da Baixada Fluminense?” Eu levantei a mão. Ela falou assim: “Quem aqui é da Baixada Fluminense pode ir embora. Porque no começo vocês vêm animados, a polícia expulsa...”   [Muitos falam ao mesmo tempo]  P7: Como se também não pudesse ser nossa opção morar na Baixada. Aí eu trabalho, eu trabalho numa, como eu falei antes, eu coordeno uma [inc.] de HIV no município. E o HIV está totalmente ligado ao empobrecimento. Na maioria dos casos é por causa do empobrecimento. E a desigualdade é muito latente, porque enquanto tem pessoas que não tomam medicamento e estão morrendo, porque não tem comida para comer, não tem comida. Tem mulheres e pessoas que amamentam que entre dar o peito, não pode amamentar e aquela criança morrer de fome. E a gente ainda tem isso no Brasil, no Rio de Janeiro. A gente acha que isso é só em África que acontece, a gente tem no Brasil, no Rio de Janeiro. E eu passo por isso todo dia e para mim é mais difícil porque eu passo isso muito com gente preta, sabe? É muito complicado... Porque eu vejo as mortes, a maioria dos casos de mortes é com pessoas pretas, são moleques pretos. Eu vejo a desigualdade todos os dias. ","ctid:1918","32 Desigualdade de acesso e/ou de oportunidades","","3 Desigualdades"
"Grupo 4 - Classe Média - Pretos - 10-10-2014.docx","José Victor","P7: Como é que vamos falar que a linha de partida é a mesma? Dessa criança, quando ela chegar no ensino médio...  P1: Pelo amor de Deus. Papo de meritocracia é ridículo. Você tem meritocracia quando os dois partem do mesmo lugar.  P6: Equidade, tem que ser na verdade.  PN: Exatamente.","ctid:1932","32 Desigualdade de acesso e/ou de oportunidades","","3 Desigualdades"
"Grupo 4 - Classe Média - Pretos - 10-10-2014.docx","José Victor","P1: Eu conheço pessoas brancas, eu acho que talvez por conviver comigo há muito tempo, por eu não ser retinto, elas devem achar que eu me enxergo como branco, eu não sei. Porque as coisas que eu escuto às vezes... Eu conheço uma que, inclusive, é uma pessoa absurdamente privilegiada, ela nasceu bem, os filhos herdaram isso, nunca precisaram se esforçar para nada. E é uma pessoa que não tem o menor pudor em abrir a boca e falar: “Pronto, agora é tudo para os negros”. Eu escuto e é do meu trabalho. O filho dela nunca precisa de nada, ela está nervosa porque alguma coisa está sendo feita para tentar minorar as desigualdades. Seja uma cota, seja o que for. Eles se doem, cara, eles se doem. Eu olhei para ela bem calmo nesse dia: “Olha só, para para pensar. Você já parou para imaginar que os seus filhos estudaram na escola alemã a vida inteira, de lá estão na PUC agora, nunca andaram um dia da vida deles sequer a pé, a não ser quando eles quiseram, foram tratados pelos melhores médicos e possuíam, desde sempre, a melhor alimentação. Você realmente acha que eles estão em condição de igualdade com o garoto lá no alto da comunidade?”. Ela diz, “Não, mas é que...” Então, pronto, você sabe que não tem... Não há algo o que dizer com relação a isso, você está se doendo, eu nem sei por quê. Você precisa, eu falei para ela: “Você tem que tentar entender por que você está se doendo por isso, que nem eu mesmo consegui entender por que você consegue se doer por uma cota”. Mas eu escuto isso. Não sei se você passa por essa experiência, mas no meu trabalho eu escuto esses absurdos.  ","ctid:1947","32 Desigualdade de acesso e/ou de oportunidades","","3 Desigualdades"
"Grupo 4 - Classe Média - Pretos - 10-10-2014.docx","José Victor","P7: Mas cadê seu negocinho, sua plaquinha também?M: Ah [risos]. P2: Então, como o XXX falou, nós somos pessoas selecionadas. Membros da nossa família abriram mão de muitas coisas para que nós chegássemos à universidade e para algumas pessoas, nós somos únicos, mas eu também penso como o XXX. Se muitas pessoas da classe trabalhadora tiverem acesso, a gente não vai deter aquela riqueza, mas a gente vai conseguir pelo menos chegar pouquinho no meio dessa...   P3: Subir um degrau, se um milhão de pessoas subirem um já muda muita coisa...","ctid:1959","32 Desigualdade de acesso e/ou de oportunidades","","3 Desigualdades"
"Grupo 4 - Classe Média - Pretos - 10-10-2014.docx","José Victor","P7: // No meu dia a dia do trabalho... Eu trabalho numa área que está diretamente ligada ao empobrecimento da população. E se os casos aumentam é porque a população está mais empobrecida, está tendo menos conhecimento. E é muita loucura também, porque você ainda mora em Nilópolis, as pessoas acham que quem mora na Baixada é todo mundo pobre. As pessoas quando eu falo acham: “Ai você ainda mora na Baixada?” Eu falo: “Ah, gente, mas por quê?”. E as pessoas acham que se a gente mora na Baixada... “Por que tu mora na Baixada?” E existe muito preconceito. Eu lembro, quando eu tinha uns 16 anos eu fui participar de uma entrevista de emprego para trabalhar numa grande marca de fast food. Aí a mulher falou assim, aqui no centro: “Quem é que é da Baixada Fluminense?” Eu levantei a mão. Ela falou assim: “Quem aqui é da Baixada Fluminense pode ir embora. Porque no começo vocês vêm animados, a polícia expulsa...”   [Muitos falam ao mesmo tempo]  P7: Como se também não pudesse ser nossa opção morar na Baixada. Aí eu trabalho, eu trabalho numa, como eu falei antes, eu coordeno uma [inc.] de HIV no município. E o HIV está totalmente ligado ao empobrecimento. Na maioria dos casos é por causa do empobrecimento. E a desigualdade é muito latente, porque enquanto tem pessoas que não tomam medicamento e estão morrendo, porque não tem comida para comer, não tem comida. Tem mulheres e pessoas que amamentam que entre dar o peito, não pode amamentar e aquela criança morrer de fome. E a gente ainda tem isso no Brasil, no Rio de Janeiro. A gente acha que isso é só em África que acontece, a gente tem no Brasil, no Rio de Janeiro. E eu passo por isso todo dia e para mim é mais difícil porque eu passo isso muito com gente preta, sabe? É muito complicado... Porque eu vejo as mortes, a maioria dos casos de mortes é com pessoas pretas, são moleques pretos. Eu vejo a desigualdade todos os dias. ","ctid:1917","33 Desigualdade espacial","","3 Desigualdades"
"Grupo 4 - Classe Média - Pretos - 10-10-2014.docx","José Victor","P2: Eu vejo a desigualdade no meu trabalho. Eu trabalho dentro do complexo da Maré e muitas das vezes eu não consigo chegar e não consigo sair da minha casa, porque eu também moro lá. Ou quando a polícia entra e eu tô dentro da sala com as crianças e eu tenho que me responsabilizar por 22 vidas. Crianças que muitas das vezes escutam um estalo do lado de fora, ou um helicóptero de uma reportagem, e essas crianças se jogam no chão e até a gente perceber que não é nada, é medo, então eu acho que a desigualdade está ali.   P1: É transtorno de estresse pós traumático.   P2: Exatamente. E é muito rotineiro, as minhas crianças, se houve um barulho que seja minimamente parecido com o barulho de tiro, todo mundo se esconde, se joga, parece até que elas são treinadas, mas na realidade é só o nosso cotidiano. Eu acho que é a minha...  P1: Condicionadas, né?  P2: Isso. ","ctid:1930","33 Desigualdade espacial","","3 Desigualdades"
