"File","Coder","Coded","Id","Codename","Coded_Memo","Category"
"Grupo 4 - Classe Média - Pretos - 10-10-2014.docx","José Victor","M: Eu vou fazer aqui só mais uma perguntinha. Enquanto eu faço e vocês vão falando. Eu vou pegar um papel que vocês precisam assinar para a gente ir fechando. Eu sei que eu estou me estendendo, mas já estamos... Nós já tocamos no ponto de que X, Y e Z podem influenciar as suas chances de ficar rico, pensamos em grupos sociais, existem grupos na sociedade que têm mais, outros que têm menos riqueza, grupos que têm maior facilidade, grupos que têm uma menor facilidade de ficar rico. E quanto às pessoas de raça, de cor diferente? Isso ainda é mais difícil?   P5: Com certeza.  P7: Ainda tem a questão de gênero também...   P1: Ohh!  P7: Não pode ser ignorada a questão de gênero.      P1: E depois, mais ainda? A sexualidade que a pessoa exerce. Da afetividade, que é o termo que eu gosto mais, entendeu? Eu não gosto de usar o termo... P5: Eu acho que a questão da sexualidade um pouco menos, mas com certeza o recorte racial...   P7: Se eu sou um gay branco ou se eu sou um gay negro. É completamente diferente.P5: E quanto mais preta a pessoa for, mais difícil vai ser para ela...  P1: Se você for um gay branco você é cool. Descolado. É legal. A sociedade atual vai dizer que é bacana.P7: Se você for um gay negro ainda tem dificuldade de você chegar até os 30 anos. P1: É. A estatística não favorece. P7: Tem a probabilidade de você chegar, sair da fase de jovem e chegar a adulto. E depois tem outras questões, o Brasil é o país que mais mata pessoas LGBTQIA+, sendo uma pessoa preta então. Aí fica difícil. Ainda mais as mulheres, né? M: Mulher. P5: Sim, também. Ainda mais.   P7: Onde estão as mulheres no topo da pirâmide? Abaixo dos homens negros. Bem abaixo dos homens negros. M: Vocês concordam com isso?   P6: Sim.  P1: Nem é questão de concordar, a sociedade está mostrando isso aí para a gente. Não tem como fugir disso.  P5: Tem muita gente que não concorda que a mulher preta está na base da pirâmide.   P1: Mas isso aí é a pessoa que está discordando por ideologia. E aí na falta de argumento ela vai só ficar lá... Mas ela não consegue te apresentar um argumento.","ctid:2132","94 Complementação","","9 Interação"
"Grupo 4 - Classe Média - Pretos - 10-10-2014.docx","José Victor","P2: E até quando essa pessoa produz riqueza, por exemplo... O Neymar, dependendo do espaço que ele estiver, ele também não vai ser bem visto. P7: E ele só se viu como pessoa negra quando começou a sofrer racismo. Exatamente, exatamente.   P2: E ele não levanta esse debate. P7: E para que gente? Para que eu vou tocar em assuntos que me são caros?   P6: O Vinicius Jr agora... Que estão batendo nele.  P7: É muito mais confortável eu não levantar essa temática... Eu perco o patrocinador. Patrocinador não quer... E ele é amigo do antigo presidente, né?  P2: É a mesma questão dos privilégios. Para que eu vou....","ctid:2138","94 Complementação","","9 Interação"
"Grupo 4 - Classe Média - Pretos - 10-10-2014.docx","José Victor","P2: Porque para mim é um problema não resolvido. A conta não bate. Vai ser um eterno problema. Eu não consigo ter... Não que eu seja uma pessoa negativa, tá gente? Mas eu não consigo ver dentro dessa estrutura, desde a colonização, desde essa questão da detenção do poder, do capital, não consigo pensar uma saída para que essa sociedade desigual passe a ser uma sociedade igual. Porque quem tem essa detenção dessa riqueza, finge e não vai abrir mão dela, não vai. E muitas das vezes, eu já tive a oportunidade de conhecer um produtor de cinema e ele se sentia um camarada militante, ajudava, blablabá, e uma semana conhecendo eu fui pontuando todas as frases racistas, todas as frases preconceituosas, enfim, perdi o amigo. Mas, assim, é desse jeito, porque se qualquer coisa que leve a eles refletirem sobre... // ","ctid:2055","990 Futuro","","99 Abrangência"
"Grupo 4 - Classe Média - Pretos - 10-10-2014.docx","José Victor","P1: Há 500 anos atrás, férias, voto feminino, liberdade para expor sua sexualidade, seja lá o que for, tudo isso é ideologia...M: XXX, que sociedade da pirâmide você gostaria de viver? Fala aí pra mim.P5: Que eu gostaria?  M: Vai, continua.  P5: Que eu queria que fosse é a “D”.  P1: Essas coisas hoje são realidade, então, assim, tudo que hoje for de utopia nada mais é do que algo que infelizmente a gente não vai gozar, mas a gente pode plantar...   P7: A gente tá cavando para que a nossa... Por exemplo, a geração anterior à minha nunca pensou em alcançar a universidade, em ser funcionário público... ","ctid:2080","990 Futuro","","99 Abrangência"
"Grupo 4 - Classe Média - Pretos - 10-10-2014.docx","José Victor","P3: Eu acho que é investimento... Pode parecer algo clichê, mas investir na educação de base e na educação de todos os níveis. Técnicos, superiores, já tiveram diversas pesquisas e estudos que comprovaram que as pessoas depois, principalmente os negros, depois que tiveram, apesar de ser ainda muito desigual o salário, de uma forma geral eles conseguiram ascender, aumentar o espaço nas faculdades públicas... É algo que vai demorar muito, mas o que já vem sendo feito nos últimos 10, 15 anos, eu acho que já começou a surtir efeito, entendeu? Então é a base... É garantir a educação de base mesmo, em todos os níveis, para que as pessoas tenham oportunidade de chegar com menos dificuldade, não é com mais facilidade, é com menos dificuldade.  ","ctid:2085","990 Futuro","","99 Abrangência"
"Grupo 4 - Classe Média - Pretos - 10-10-2014.docx","José Victor","P4: Independente disso, olha só.... Eu tenho uma filha, minha filha tem 9 anos, minha filha tem [inc.], um nível de suporte, tudo. Hoje tudo que eu faço, eu faço em direção a ela. Eu quero juntar bens... Porque minha filha hoje ela tá bem para caramba, mas ela pode amanhã, a minha filha às vezes ela tá aqui na matemática fazendo tudo, daqui a pouco eu “Quanto que é dois mais dois?” E ela... Então tudo que eu faço hoje é para ela, vamos dizer que seja eu nesse caso, eu juntei as dez casas, porque eu só tenho uma filha e eu quero deixar para ela. Eu acho que, independente de quem seja, eu acho que eu fiz, eu trabalhei para isso, para fazer isso. Aí chega lá na frente, o meu desejo não pode ser feito? Para ela, passar para ela? Independente de qual seja o motivo. // ","ctid:2103","990 Futuro","","99 Abrangência"
"Grupo 4 - Classe Média - Pretos - 10-10-2014.docx","José Victor","P2: Porque para mim é um problema não resolvido. A conta não bate. Vai ser um eterno problema. Eu não consigo ter... Não que eu seja uma pessoa negativa, tá gente? Mas eu não consigo ver dentro dessa estrutura, desde a colonização, desde essa questão da detenção do poder, do capital, não consigo pensar uma saída para que essa sociedade desigual passe a ser uma sociedade igual. Porque quem tem essa detenção dessa riqueza, finge e não vai abrir mão dela, não vai. E muitas das vezes, eu já tive a oportunidade de conhecer um produtor de cinema e ele se sentia um camarada militante, ajudava, blablabá, e uma semana conhecendo eu fui pontuando todas as frases racistas, todas as frases preconceituosas, enfim, perdi o amigo. Mas, assim, é desse jeito, porque se qualquer coisa que leve a eles refletirem sobre... // ","ctid:2054","991 Passado","","99 Abrangência"
"Grupo 4 - Classe Média - Pretos - 10-10-2014.docx","José Victor","P1: Há 500 anos atrás, férias, voto feminino, liberdade para expor sua sexualidade, seja lá o que for, tudo isso é ideologia...M: XXX, que sociedade da pirâmide você gostaria de viver? Fala aí pra mim.P5: Que eu gostaria?  M: Vai, continua.  P5: Que eu queria que fosse é a “D”.  P1: Essas coisas hoje são realidade, então, assim, tudo que hoje for de utopia nada mais é do que algo que infelizmente a gente não vai gozar, mas a gente pode plantar...   P7: A gente tá cavando para que a nossa... Por exemplo, a geração anterior à minha nunca pensou em alcançar a universidade, em ser funcionário público... ","ctid:2079","991 Passado","","99 Abrangência"
"Grupo 4 - Classe Média - Pretos - 10-10-2014.docx","José Victor","P3: Eu acho que é investimento... Pode parecer algo clichê, mas investir na educação de base e na educação de todos os níveis. Técnicos, superiores, já tiveram diversas pesquisas e estudos que comprovaram que as pessoas depois, principalmente os negros, depois que tiveram, apesar de ser ainda muito desigual o salário, de uma forma geral eles conseguiram ascender, aumentar o espaço nas faculdades públicas... É algo que vai demorar muito, mas o que já vem sendo feito nos últimos 10, 15 anos, eu acho que já começou a surtir efeito, entendeu? Então é a base... É garantir a educação de base mesmo, em todos os níveis, para que as pessoas tenham oportunidade de chegar com menos dificuldade, não é com mais facilidade, é com menos dificuldade.  ","ctid:2084","991 Passado","","99 Abrangência"
"Grupo 4 - Classe Média - Pretos - 10-10-2014.docx","José Victor","P7: Mas cadê seu negocinho, sua plaquinha também?M: Ah [risos]. P2: Então, como o XXX falou, nós somos pessoas selecionadas. Membros da nossa família abriram mão de muitas coisas para que nós chegássemos à universidade e para algumas pessoas, nós somos únicos, mas eu também penso como o XXX. Se muitas pessoas da classe trabalhadora tiverem acesso, a gente não vai deter aquela riqueza, mas a gente vai conseguir pelo menos chegar pouquinho no meio dessa...  ","ctid:2086","991 Passado","","99 Abrangência"
"Grupo 4 - Classe Média - Pretos - 10-10-2014.docx","José Victor","P2: Eu acho muito justo. P1: Vou fazer uma observação. Há 20 anos atrás, o pai pobre, a mãe solo ou a [inc.] de família se sujeitava ao que fosse para poder manter o seu sustento, né? Hoje, não mais. Hoje as pessoas já não estão mais se sujeitando a qualquer absurdo. O que modificou isso tudo? Um programa de distribuição de renda como o Bolsa Família. Critiquem o quanto quiserem, mas é o que está tirando as pessoas da miserabilidade e é o que está dando a elas o direito de não serem... De pelo menos não serem humilhadas porque elas sabem que se elas não quiserem se sujeitar a alguma coisa, mas a comida dela está garantida. Dos filhos. Ah, isso faz diferença na sociedade.P7: E nós, a galera aqui dos 30 anos, a galera que foi da geração do Bolsa Família. A galera de 30 e poucos anos. Eu sou da geração Bolsa Família.   P2: Eu sou da geração Cheque Cidadão.  P7: Eu também, minha mãe pegava. O Garotinho. P2: Sustentei muito os meus filhos com isso. P7: E o que fez com que eu tivesse mais acesso à educação foram esses programas. Porque minha mãe recebia o Bolsa família e o que a minha mãe fazia? Tirava um pedaço desse dinheiro para pagar um curso de inglês para mim.   P1: São os programas de renda mínima que fazem um milhão subir um degrau.   P7: Sim. Sabe, e hoje eu tenho irmãos que, meu Deus do céu, meus irmãos… Vou contar tudo isso para os caras. ","ctid:2090","991 Passado","","99 Abrangência"
"Grupo 4 - Classe Média - Pretos - 10-10-2014.docx","José Victor","P1: Aqui no Brasil a gente é tão desigual, nós somos tão pobres. Eu comecei a minha vida de forma... Não posso dizer que eu era pobre, mas era bastante humilde. Então muitas coisas que eu tenho hoje eu nem sonhava em ter quando eu era garoto. Para falar a verdade, aos 18 anos de idade, eu achava que eu nunca teria um carro, coisa doida, como a gente é criado dentro daquele contexto, a gente não enxerga as coisas como elas podem ser. Mas, assim, como gestor, eu diria que riqueza é você não precisar ou poder parar de trabalhar. Isso aqui a gente associa com riqueza, bens materiais, que a gente não tem. Lá fora é tão fácil as pessoas terem as coisas. Mas, assim, as únicas pessoas que são ricas de verdade são aquelas que podem se dar luxo de não trabalhar ou de poder: “Ah, não quero mais exercer essa atividade; chega, para mim já deu”. Quantos de nós podemos realmente tirar um ano sabático? Tipo, esse ano não vou trabalhar porque eu quero me dedicar só a uma atividade X ou Y. A gente nunca para para pensar nisso, né? A gente só sabe que a gente quer fazer alguma coisa e o tempo não para. ","ctid:1993","992 Global","","99 Abrangência"
"Grupo 4 - Classe Média - Pretos - 10-10-2014.docx","José Victor","P1: Imagina o cara que tem um armazém lá no meio da Zona Norte. Ele começou a prosperar e aí ele pegou esse dinheiro e tá investindo ali em volta, tá fomentando a quadra de esporte lá, tá montando o professor de educação física para dar aula. Tá pagando mais, né? Tá pagando o profissional de saúde para fazer...P2: Eu não consegui interpretar desse jeito. Divide, beneficie a sua comunidade. Comunidades são aquelas pessoas que estão ali comigo. No mesmo bairro, entendeu? Então, assim, eu consigo ter a percepção de ser uma comunidade rica. P1: Isso é muito um modelo que tem na Europa e nos Estados Unidos, que os mega empresários fazem muitas ações sociais para justificar aquela grana.  ","ctid:2112","992 Global","","99 Abrangência"
"Grupo 4 - Classe Média - Pretos - 10-10-2014.docx","José Victor","P4: Eu diria que é uma meia verdade. Eu conheço pessoas, por exemplo... Eu não tive muito a realidade de muita gente. Meu pai era militar oficial, eu nunca passei, vamos dizer, o perrengue, mas eu moro em Nilópolis. Eu moro no meio de duas comunidades, então eu vivi essa realidade diariamente...  M: A gente está falando de riquezas.  P4: É, tá. Aonde eu quero chegar? Por exemplo, eu não sou rico, mas hoje eu vivo de forma confortável, e eu conheço pessoas que vieram do mesmo lugar que eu vim, e com muito mais dificuldade de tudo, e essas pessoas estão ricas. Trabalhando, e trabalhando de forma honesta. Eu não vou te dizer que é uma regra que a pessoa vai trabalhar e ela não vai enriquecer. Tem gente que trabalha e enriquece. Tem gente que, eu diria que eu vejo muitas vezes pessoas que colocam... Eu estou falando isso agora comigo, porque eu hoje emprego também bastante gente e às vezes as pessoas tiram a gente como vilão e não é assim. Porque eu trabalho muito, eu trabalho 16 horas por dia, eu tenho 5 funcionários e por aí vai. Só que as pessoas ficam naquela de “Ah, o patrão é vilão”. Não, o patrão não é vilão. ","ctid:6298","993 Local","","99 Abrangência"
"Grupo 4 - Classe Média - Pretos - 10-10-2014.docx","José Victor","P7: Olha, eu sou da saúde, eu vejo toda hora, porque eu trabalho numa área... //  M: Eu quero ver no seu dia a dia.  P7: // No meu dia a dia do trabalho... Eu trabalho numa área que está diretamente ligada ao empobrecimento da população. E se os casos aumentam é porque a população está mais empobrecida, está tendo menos conhecimento. E é muita loucura também, porque você ainda mora em Nilópolis, as pessoas acham que quem mora na Baixada é todo mundo pobre. As pessoas quando eu falo acham: “Ai você ainda mora na Baixada?” Eu falo: “Ah, gente, mas por quê?”. E as pessoas acham que se a gente mora na Baixada... “Por que tu mora na Baixada?” E existe muito preconceito. Eu lembro, quando eu tinha uns 16 anos eu fui participar de uma entrevista de emprego para trabalhar numa grande marca de fast food. Aí a mulher falou assim, aqui no centro: “Quem é que é da Baixada Fluminense?” Eu levantei a mão. Ela falou assim: “Quem aqui é da Baixada Fluminense pode ir embora. Porque no começo vocês vêm animados, a polícia expulsa...”   [Muitos falam ao mesmo tempo]  P7: Como se também não pudesse ser nossa opção morar na Baixada. Aí eu trabalho, eu trabalho numa, como eu falei antes, eu coordeno uma [inc.] de HIV no município. E o HIV está totalmente ligado ao empobrecimento. Na maioria dos casos é por causa do empobrecimento. E a desigualdade é muito latente, porque enquanto tem pessoas que não tomam medicamento e estão morrendo, porque não tem comida para comer, não tem comida. Tem mulheres e pessoas que amamentam que entre dar o peito, não pode amamentar e aquela criança morrer de fome. E a gente ainda tem isso no Brasil, no Rio de Janeiro. A gente acha que isso é só em África que acontece, a gente tem no Brasil, no Rio de Janeiro. E eu passo por isso todo dia e para mim é mais difícil porque eu passo isso muito com gente preta, sabe? É muito complicado... Porque eu vejo as mortes, a maioria dos casos de mortes é com pessoas pretas, são moleques pretos. Eu vejo a desigualdade todos os dias. ","ctid:2035","993 Local","","99 Abrangência"
"Grupo 4 - Classe Média - Pretos - 10-10-2014.docx","José Victor","P3: Todo mundo deve ter exemplos, mas a desigualdade é você andando na rua, você saindo daqui do prédio, você já vai ver a Câmara dos Vereadores e em compensação, 5 metros à frente, tem gente em situação de rua, entendeu? Não precisa ir muito longe.  P7: E ali é a casa do povo, né?     P8: Exatamente.  P6: Exatamente.  P3: E os caras têm carros blindados, um Corola, acabei de ver ali saindo. Então é perto, né? Olhando aqui você vê desigualdade em tudo que é lugar, seja no Centro, na Zona Sul, na Zona Norte.   P6: E no Rio de Janeiro está muito claro isso, você consegue ver, na verdade, em cidades como Rio de Janeiro, São Paulo. No Rio é até mais, porque o Rio é um pouco mais concentrado aqui no centro do Rio, enfim, você consegue ver essa desigualdade nítida.  P3: E se você pegar o Aterro do Flamengo, que dá para ir até a pé para a Zona Sul, você já vai ver uma outra realidade completamente diferente.  P6: Parece até outro país.  P3: 5 km de distância do Centro para a Zona Sul.   P8: Eu ia citar esse exemplo que ele falou, que tá sobre nossa cidade o tempo inteiro. No mês passado, a gente teve uma confraternização aqui no Amarelinho, aqui do lado da Cinelândia, onde tinha alguns empresários do ramo de comunicação. Um deles inclusive detentor do Teatro Riachuelo, enfim. E o pessoal lá confraternizando e gastando a balde na calçada ao lado as pessoas implorando por comida, por atenção, por água. E aquelas pessoas muitas vezes invisíveis para todo mundo e eu fiquei olhando... Eu tô aqui do lado de um grande empresário, e o cara aqui do nosso lado, no mesmo quadrante que a gente, não tem acesso à água, não tem acesso a... ","ctid:2044","993 Local","","99 Abrangência"
"Grupo 4 - Classe Média - Pretos - 10-10-2014.docx","José Victor","P1: Eu conheço pessoas brancas, eu acho que talvez por conviver comigo há muito tempo, por eu não ser retinto, elas devem achar que eu me enxergo como branco, eu não sei. Porque as coisas que eu escuto às vezes... Eu conheço uma que, inclusive, é uma pessoa absurdamente privilegiada, ela nasceu bem, os filhos herdaram isso, nunca precisaram se esforçar para nada. E é uma pessoa que não tem o menor pudor em abrir a boca e falar: “Pronto, agora é tudo para os negros”. Eu escuto e é do meu trabalho. O filho dela nunca precisa de nada, ela está nervosa porque alguma coisa está sendo feita para tentar minorar as desigualdades. Seja uma cota, seja o que for. Eles se doem, cara, eles se doem. Eu olhei para ela bem calmo nesse dia: “Olha só, para para pensar. Você já parou para imaginar que os seus filhos estudaram na escola alemã a vida inteira, de lá estão na PUC agora, nunca andaram um dia da vida deles sequer a pé, a não ser quando eles quiseram, foram tratados pelos melhores médicos e possuíam, desde sempre, a melhor alimentação. Você realmente acha que eles estão em condição de igualdade com o garoto lá no alto da comunidade?”. Ela diz, “Não, mas é que...” Então, pronto, você sabe que não tem... Não há algo o que dizer com relação a isso, você está se doendo, eu nem sei por quê. Você precisa, eu falei para ela: “Você tem que tentar entender por que você está se doendo por isso, que nem eu mesmo consegui entender por que você consegue se doer por uma cota”. Mas eu escuto isso. Não sei se você passa por essa experiência, mas no meu trabalho eu escuto esses absurdos.  ","ctid:2061","993 Local","","99 Abrangência"
"Grupo 4 - Classe Média - Pretos - 10-10-2014.docx","José Victor","P5: Quem é XXX? P8: Sou eu. Quem tá no meio para mim é essa expressão que eu usei... É talvez o dublê de rico.   M: O dublê de rico.   [Muitos falam ao mesmo tempo]   P8: É a pessoa que tem uma renda às vezes considerada alta diante da grande maioria da população, mas ele também não consegue chegar no topo. Ele tenta chegar no topo, em quem tem os poderes...P1: Ele consome de forma parcelada bem e serviços, que ele não poderia pagar à vista, para parecer ser mais rico do que ele realmente é.P8: Exatamente. P7: Essa é uma Barra da Tijuca.   P1: Isso. O famoso emergente  P8: É o cara que é o emergente.  P1: Apesar de que na Barra também tem uns verdadeiramente ricos, mas o grosso da Barra da Tijuca é esse. Eu sei porque eu já morei lá.   P7: É essa galera também. ","ctid:2073","993 Local","","99 Abrangência"
"Grupo 4 - Classe Média - Pretos - 10-10-2014.docx","José Victor","M: É impossível uma pessoa acumular riqueza mesmo não vindo de uma família rica?   P2: Eu acho impossível.   M: Todo mundo acha impossível?  P5: Impossível não é.  P6: Impossível não é a palavra, mas... Praticamente impossível.  [Muitos falam ao mesmo tempo]  P4: É subjetivo. O mesmo que é riqueza para ele, não é pra mim. Por exemplo, o cara quer 10 imóveis. Pô, ter 10 imóveis no Leblon é complicado. Ter 10 imóveis em Japeri já é mais fácil. Aí tem gente que tá lá em Japeri...  P1: É que a pesquisa usa esse número mágico, que é uma forma de ilustrar, mas o que eles querem dizer, é isso: são 10 imóveis no Leblon.  P4: Mas... Isso aí é surreal. ","ctid:2129","993 Local","","99 Abrangência"
"Grupo 4 - Classe Média - Pretos - 10-10-2014.docx","José Victor","M: Eu vou fazer aqui só mais uma perguntinha. Enquanto eu faço e vocês vão falando. Eu vou pegar um papel que vocês precisam assinar para a gente ir fechando. Eu sei que eu estou me estendendo, mas já estamos... Nós já tocamos no ponto de que X, Y e Z podem influenciar as suas chances de ficar rico, pensamos em grupos sociais, existem grupos na sociedade que têm mais, outros que têm menos riqueza, grupos que têm maior facilidade, grupos que têm uma menor facilidade de ficar rico. E quanto às pessoas de raça, de cor diferente? Isso ainda é mais difícil?   P5: Com certeza.  P7: Ainda tem a questão de gênero também...   P1: Ohh!  P7: Não pode ser ignorada a questão de gênero.      P1: E depois, mais ainda? A sexualidade que a pessoa exerce. Da afetividade, que é o termo que eu gosto mais, entendeu? Eu não gosto de usar o termo... P5: Eu acho que a questão da sexualidade um pouco menos, mas com certeza o recorte racial...   P7: Se eu sou um gay branco ou se eu sou um gay negro. É completamente diferente.P5: E quanto mais preta a pessoa for, mais difícil vai ser para ela...  P1: Se você for um gay branco você é cool. Descolado. É legal. A sociedade atual vai dizer que é bacana.P7: Se você for um gay negro ainda tem dificuldade de você chegar até os 30 anos. P1: É. A estatística não favorece. P7: Tem a probabilidade de você chegar, sair da fase de jovem e chegar a adulto. E depois tem outras questões, o Brasil é o país que mais mata pessoas LGBTQIA+, sendo uma pessoa preta então. Aí fica difícil. Ainda mais as mulheres, né? M: Mulher. P5: Sim, também. Ainda mais.   P7: Onde estão as mulheres no topo da pirâmide? Abaixo dos homens negros. Bem abaixo dos homens negros. M: Vocês concordam com isso?   P6: Sim.  P1: Nem é questão de concordar, a sociedade está mostrando isso aí para a gente. Não tem como fugir disso.  P5: Tem muita gente que não concorda que a mulher preta está na base da pirâmide.   P1: Mas isso aí é a pessoa que está discordando por ideologia. E aí na falta de argumento ela vai só ficar lá... Mas ela não consegue te apresentar um argumento.","ctid:2133","994 Nacional","","99 Abrangência"
